Reviewer_ID,Reviewee_1_ID,Reviewee_1_Story,Reviewee_2_ID,Reviewee_2_Story,Reviewee_3_ID,Reviewee_3_Story
6352436,5134695,お馴染みのコンビニ入店音が鳴ったからである。それを敵襲と勘違いした大魔王は、直後に店員からかけられた言葉である「いらっしゃいませ～」にも反応した。「貴様いま我にかけた魔法は何だ正直に言え」と店員に詰め寄るも、酔っ払いかドッキリの類だと勘違いした店員は「何かお探しですか？」と取り合わない。大魔王が理解できずにキョトンとしていると、店員はこの辺でやっている仮装パーティーだったらこれに載っているとタウン情報誌を持ってきた。奇しくも人間界の視察という目的は、1冊の情報誌で果たされそうである。,4022924,「あ～しまった。財布持ってくるの忘れた！お店に入るのに財布は必須･･･」との無念さがよぎったが、せっかく来たしとりあえず「勉強のために」入ってみることに。「ふむ、色んなものがあるの～、全部欲しいな～」とウロウロしていたが、そのうち妙なことに気づいた。商品を抱え、レジに向かう若者、どうも一向に財布を取り出す気配がない…（ペイペイ♪とか言ってる？）「そうか、時代が変わって豊かになって、好きなものはお金と交換しなくてもよくなったのか！いや、いい時代になったの～」と、晴れやかな顔で両手いっぱいに商品を抱え、レジに向かったのだった…,1426807,なぜなら、店の中に悪魔がいたからである。地獄では見たことのない女の悪魔2匹が、楽しげに歩いている。人間界と行き来できるのは、幹部クラスの者だけのはず。なぜ、こんなところに？咎めようと店に入り2人の前に立つと、彼女たちは驚くどころか舌打ちをして通り過ぎ、店を出てしまった。こちらが驚いて慌てて店を出ると、他にも魔女や死神、モンスターがあふれている。人間界に来たつもりが、どうやら間違えて他の世界線の地獄に来てしまったようだ。
6635834,3879877,"自動ドアが開かない。魔力が切れたかと焦る大魔王だが、理由は単純、ただのセンサーの感知だった。「お待ちください。お客様、そのコスプレ…いえ、装備。角の先端がセンサーに干渉します」とバイトの店員に制されたのだ。

憤怒に震えつつも、空腹に負けた魔王は大人しく角を折り畳んで入店。漆黒の衣を翻し、欲望の渦巻く「ホットスナック」の棚へ。魔界の業火を凌ぐ熱を放つ『ファミチキ』を指差し、「これの魂を貰おう」と凄んだが、店員は無慈悲に言った。 「袋と、ポイントカードはお持ちですか？」 「ぽ、ぽいんと…？」 数万の魂を支配する王が、初めて「還元率」という名の人間界の魔術に屈した瞬間であった。",6352436,従者は連れてきていないはず、なのに、ドアが開いたのだ。なぜ。いつのまに人間の文明が地獄の摂理を凌駕したのか。地獄に来た人間には、地獄インフラをつくるために24時間休みなしで働かせているのに、なぜやつらがこの扉を用意しないのだ。地獄現場監督の人間が150年前に死んだやつだからか？やはり、若者の登用が必要なのか？今度100年目のやつと入れ替えるか。ピコン。ん？なんだ？あ、ただの魔王からのメッセージ？は？メッセージ？なんだこの四角い板は！？「前に下界行ったときに買ったやつ。ポッケに入れといたよ。」ってなんだこれは！？書簡じゃなくても届くのか？おまえ、下界きたの20年前だろ！報告はどうなってんだよ！！,2295029,"おにぎり一個１万円。日本は超インフレにより、モノの値段が高騰していた。遠足気分で人間界へやってきた大魔王のこづかい１万円は、コンビニおにぎり一つに消える。
怒りを覚えた大魔王は、地上征服の前にまず日本の財政金融改革に乗り出した。選挙に出馬し政党を立ち上げ総理大臣になった大魔王は、血も涙もない政策を断行する。
たとえ悪魔と罵られても、事実なので痛くもかゆくもない。その甲斐あってか、日本の超インフレは徐々に収束した。政治家を引退した大魔王は自叙伝を出版し、政財界のバイブルとなる。"
748096,6525247,自動ドアが反応せず、大魔王は「結界だな」と睨んだ。直後、後ろのサラリーマンが通過してドアが開く。真似ると成功し、文明に敗北を感じる。棚には悪魔の心臓より赤い唐揚げ、蘇生薬めいたエナジードリンク。レジで「温めますか？」に続き、「袋いりますか、ポイントカードありますか、支払いは何で」。三連撃に角がしおれ、現金を出すと「小銭あります？」でとどめを刺された。,5397082,店内から漂う「おでん」の出汁の香りに、強烈な郷愁をそそられたようだ。「この煮えたぎる鍋の香り…まさか地獄の釜茹でがここにあるとは」と勘違いした大魔王。恐る恐る鍋を覗き込む姿は、初めてのお使いに来た子供のようで少し可愛らしい。結局、店員に「しらたき」を指差し、「この白きウジのようなものをくれ」と注文。魔王といえども、日本の出汁の誘惑には勝てなかったようで、少し親近感が湧いてしまった。,5327663,中に入ろうとしましたが、 みんな 入るには スマホ の 画面を 見せてから 入っていました。 大魔王も そのまま入ろうと思いましたが スマホを持っていないために入ることができません。仕方がないので、大魔王、 その場で立ち尽くすことしかできませんでした。 入場ゲートには QR コードを 読み取る仕組み だったのです。
4409144,4203930,"大魔王は入り口で足を止め、まるで罠でもあるかのようにキョロキョロした。そこには、明るい蛍光灯の下で「おにぎり150円」の看板が揺れているだけだった。
ふと横を見ると、女子高生がイヤホンから流れる音楽に合わせて小声で踊りながら、スマホに夢中でぶつかってくる。大魔王は思わず「我が力、何たる無力…！」と嘆き、でも負けじと一歩踏み出すと、自動ドアが開き、レジ横のチョコレートに目がくらむ。
慌てて手を伸ばした瞬間、スマホを凝視していたサラリーマンにぶつかり、二人で「すみませんすみません」と交錯。大魔王、地獄の統治者の威厳、瞬時に消滅。渋谷の洗礼、完了である。",620899,"突然目の前のコンビニの扉(自動ドア)が「さあ、入ってこい」と言わんばかりに開いたことに驚く魔王。
「なにかの罠か？周りの人間共が我を目にして少しも動揺する様子がないことも不可思議だ」

人間たちが共謀して自分を捕らえようとしていることを警戒した魔王はコンビニから離れ、周囲を見回した。

その日はハロウィン、10月31日であった。",2295029,"おにぎり一個１万円。日本は超インフレにより、モノの値段が高騰していた。遠足気分で人間界へやってきた大魔王のこづかい１万円は、コンビニおにぎり一つに消える。
怒りを覚えた大魔王は、地上征服の前にまず日本の財政金融改革に乗り出した。選挙に出馬し政党を立ち上げ総理大臣になった大魔王は、血も涙もない政策を断行する。
たとえ悪魔と罵られても、事実なので痛くもかゆくもない。その甲斐あってか、日本の超インフレは徐々に収束した。政治家を引退した大魔王は自叙伝を出版し、政財界のバイブルとなる。"
5641232,4683008,コンビニの中に数人の客がいたが、スタッフらしき人がいなかった。どうやら無人のコンビニらしい。支払いは現金がだめで、スマホ決済になっていた。大魔王は現金は持っていたが、スマホを持っていなかった。大魔王は仕方なく、スタッフのいるコンビニを探した。,6144768,"「おいおい、どうなってるんだよ…」大魔王は、目の前の状況を受け止められずにいた。なぜなら以前来たときは、まだ江戸時代。
コンビニの自動ドアに戸惑いながらも、陳列されている品物に目を奪われる。
「おお、ありがたいな、献上品とは。」おにぎり二つといなり寿司を手に取り、店を立ち去ろうとする。
すかさず後ろから「お客様！！お待ちください！！」若い店員が慌てて声をかけてくる。
「なんだお前は！大魔王に対して失礼であるぞ！」怒鳴る大魔王。
怖くなった店員は「不審者です、助けてください」と咄嗟に手に持っていたＳＯＳボタンを押す。
数分後、やってきたのは警察であった。「おい！やめろ！」連行される大魔王、どうなる…",4606205,自動ドアが反応しない、おかしいなと思いドアガラスを覗き込むと…自分の姿が映えになっているではないか。どうりで自分が近づいても人や自動ドアが反応しないわけだ。本当の姿に返信しようと呪文を唱えようとしたところ、ハエだから呪文が唱えられない。仕方ないからどこか手掛かりがないか探そうと飛んだ。すると何か懐かしい、温かな光が見えてきた。そこに行って今後の対策を立てようかと考えて近づいた。すると…バチッ。一瞬の音がした瞬間周りは暗くなり意識を失ってしまった。数時間後、コンビニの店員は虫除けライトの下にいたハエを捕まえてゴミ箱に入れた
1798984,5397082,店内から漂う「おでん」の出汁の香りに、強烈な郷愁をそそられたようだ。「この煮えたぎる鍋の香り…まさか地獄の釜茹でがここにあるとは」と勘違いした大魔王。恐る恐る鍋を覗き込む姿は、初めてのお使いに来た子供のようで少し可愛らしい。結局、店員に「しらたき」を指差し、「この白きウジのようなものをくれ」と注文。魔王といえども、日本の出汁の誘惑には勝てなかったようで、少し親近感が湧いてしまった。,6714290,中には、痩せこけて疲れ果てたサラリーマンたちがおにぎりを選んでいたり、お財布の中を見て漫画を買うのをやめた少年がいたり、肌の露出が多い人間の本を盗もうとしてる人さまざまな人間がいた。大魔王はそこでこう思ったのだ。「地獄より人間界の方が過酷ではないのか」と。,4022924,「あ～しまった。財布持ってくるの忘れた！お店に入るのに財布は必須･･･」との無念さがよぎったが、せっかく来たしとりあえず「勉強のために」入ってみることに。「ふむ、色んなものがあるの～、全部欲しいな～」とウロウロしていたが、そのうち妙なことに気づいた。商品を抱え、レジに向かう若者、どうも一向に財布を取り出す気配がない…（ペイペイ♪とか言ってる？）「そうか、時代が変わって豊かになって、好きなものはお金と交換しなくてもよくなったのか！いや、いい時代になったの～」と、晴れやかな顔で両手いっぱいに商品を抱え、レジに向かったのだった…
1426807,6716992,"なんとそこには魔族の格好をしたものがたくさんいたのだ。大魔王は驚き声をかける。
「なぜ貴様ら魔族が人間界にいるのだ？」
こっちを見た魔族供はなんと人間の顔をしていた。
すると人間供のヒソヒソ話が聞こえた。
「あの人の仮装本格的じゃね？」
「コスプレイヤーの人かな！？」
気づいた時には大魔王は四角い板(スマホ)を持った人間で取り囲まれていた。
大魔王は抵抗する間もなく弱点である光属性のフラッシュ光を大量に浴びせられその場で倒れてしまった。",3292962,"「以前に来たときはこんな建物なかったが、一体何をする所だ？やたら明るいし。それに何じゃこいつらは妙な四角い板を翳して邪魔くさい・・・」
数百年ぶりに人間界に降り立った大魔王にはコンビニもスマホも未知のしろものである。
するといつまでも自動ドアの前で立ち止まっている魔王にヤンキー2人組が近づいてきた。
「おいお前入るならさっさと入れよ」「何、こいつおもしれ―格好してんじゃん。コスプレってやつか？なんのキャラなんコレっ！お前知ってる？」
2人組は、まさか目の前の人物が地獄を統べる大魔王とは夢にも思わず、馬鹿にする感じで好き勝手に言ってきた。",6635834,大魔王はコンビニの入り口から入るにはあまりにもデカかった。立派な角が、自動ドアに引っかかる。コンビニの入り口は、防犯用に身長の目安がわかるようになっている。２１０ｃｍ。入口に目を向けた店員はぎょっとしたが、それでも入店を拒否したりはしなかった。多様性が叫ばれる世の中、この程度のファッションはコスプレの範囲であった。ヴィジュアル系バンドのメンバーか。はたまた何かのステージショーの敵役か？　地獄の大魔王は外見で中身を判断しない様子に感心したが、若者の関心はもっぱら板の中だ。動画もアップロードされたのだが、この時代、生成AIが疑われたのは皮肉なことだ。のち、SNSのトレンドをにぎわせることになる。
6440204,367640,"というのも、コンビニが複数あるのだ。
目の前だけでなく。左右にも後ろにも。
しかも異なった系列店が複数あるならともかく、同チェーン店が隣にもある。
大魔王からすると、目の前のコンビニと隣の同チェーン店との違いが全く分からず、どちらに入ればいいかが全く分からない。
しかし、何故か人間どもは大魔王のように迷うことなく、それぞれの店舗へと入っていく。
人間界に来て早々、人間どもには一体何が見えているのだと大魔王は悩むのであった。",5397082,店内から漂う「おでん」の出汁の香りに、強烈な郷愁をそそられたようだ。「この煮えたぎる鍋の香り…まさか地獄の釜茹でがここにあるとは」と勘違いした大魔王。恐る恐る鍋を覗き込む姿は、初めてのお使いに来た子供のようで少し可愛らしい。結局、店員に「しらたき」を指差し、「この白きウジのようなものをくれ」と注文。魔王といえども、日本の出汁の誘惑には勝てなかったようで、少し親近感が湧いてしまった。,3292962,"「以前に来たときはこんな建物なかったが、一体何をする所だ？やたら明るいし。それに何じゃこいつらは妙な四角い板を翳して邪魔くさい・・・」
数百年ぶりに人間界に降り立った大魔王にはコンビニもスマホも未知のしろものである。
するといつまでも自動ドアの前で立ち止まっている魔王にヤンキー2人組が近づいてきた。
「おいお前入るならさっさと入れよ」「何、こいつおもしれ―格好してんじゃん。コスプレってやつか？なんのキャラなんコレっ！お前知ってる？」
2人組は、まさか目の前の人物が地獄を統べる大魔王とは夢にも思わず、馬鹿にする感じで好き勝手に言ってきた。"
6158040,1426807,なぜなら、店の中に悪魔がいたからである。地獄では見たことのない女の悪魔2匹が、楽しげに歩いている。人間界と行き来できるのは、幹部クラスの者だけのはず。なぜ、こんなところに？咎めようと店に入り2人の前に立つと、彼女たちは驚くどころか舌打ちをして通り過ぎ、店を出てしまった。こちらが驚いて慌てて店を出ると、他にも魔女や死神、モンスターがあふれている。人間界に来たつもりが、どうやら間違えて他の世界線の地獄に来てしまったようだ。,972848,入り口のガラス張りの自動ドアに自分の姿が映っていな事に気付く。なんてことだ・・・。人間界では地獄界の住人の姿は透明人間になるのか。どおりで、周囲の人間達が自分を見ても何の反応もないわけだ。地獄界では周囲が恐怖に怯えるほどの風貌をしているというのに、人間界では無色透明。人間達を驚かしてやろうとワクワクして降り立ったというに、肩透かしもいいとこた。いや、待てよ。透明人間・・・・。人間界の視察にはもってこいの状況じゃないか。手始めに、地獄界で噂になっていた人間界の光と闇が横行する歌舞伎町とやらに潜入して、どんな人間達が息をひそめているのかお手並み拝見するとしよう。,6714290,中には、痩せこけて疲れ果てたサラリーマンたちがおにぎりを選んでいたり、お財布の中を見て漫画を買うのをやめた少年がいたり、肌の露出が多い人間の本を盗もうとしてる人さまざまな人間がいた。大魔王はそこでこう思ったのだ。「地獄より人間界の方が過酷ではないのか」と。
6525247,1426807,なぜなら、店の中に悪魔がいたからである。地獄では見たことのない女の悪魔2匹が、楽しげに歩いている。人間界と行き来できるのは、幹部クラスの者だけのはず。なぜ、こんなところに？咎めようと店に入り2人の前に立つと、彼女たちは驚くどころか舌打ちをして通り過ぎ、店を出てしまった。こちらが驚いて慌てて店を出ると、他にも魔女や死神、モンスターがあふれている。人間界に来たつもりが、どうやら間違えて他の世界線の地獄に来てしまったようだ。,5737395,コンビニの中に、人間でも等身大パネルでもない存在がうごめいていたのだ。「なんだ･･･あのすべるように動く奇妙な生物は･･･。地球生物百科事典には載ってなかったぞ･･･。地球人は、いつの間にやらエイリアンと共存していたのか？」ともあれ、大魔王はコンビニの中に入ることにした。「いらっしゃいませ。今日のオススメは、味のしない飴です」「うわっ！話しかけてきた！それにしても、甘いから飴なのに、味のしないって･･･」「スマホで決済できますよ」「地球人は、現金も廃止したのか･･･それにしても、こいつ、何奴･･･」大魔王は、その生物の前でフリーズしたままだった。彼は、AIロボットを知らなかったのだ･･･。,3224364,その横でヤンキーたちがヤンキー座りで屯してました。大魔王がその光景を眺めているとヤンキーの一人が「なんだお前！メンチ切ってんじゃねーぞ。コラっ」と言いながら立ち上がると大魔王に近づいて服を掴んできました。大魔王が「失せろ。下等生物がっ」と言ったのに続き「デス」と言うとヤンキーが爆発して血が回りに飛び散りました。それを見た人達が悲鳴を上げながら逃げ始めました。
3879877,5259963,"ガラス越しに見える店員が、客に対して頭を下げ、商品を手渡している。大魔王はそれを見てニヤリとした。「ふむ、人間どもが貢物を献上しておるな」。
しかしよく見ると、客のほうが金という名の金属片を差し出しているではないか。「な、なんと……！ 物を受け取る側が、逆に金属を支払わされているというのか！？」
搾取の構造が逆転している現代資本主義のシステムが理解できず、大魔王は「この世界、地獄より世知辛いのでは？」と恐怖して足がすくんだ。",95866,入り口付近で複数の若者が地べたに座り込んで大声で騒いでいたのだ。自分よりも目立っている存在が許せない大魔王は若者たちに声をかけ説教を行った。若者たちは渋々コンビニから立ち去り、大魔王は満足げに若者たちを見送った。するとコンビニの店長が大魔王の前に現れて若者たちを追い払ってくれてありがとうと感謝されたのだった。,5898311,入り口のドアが開かなかったのだ。大魔王はドアにも認知されないらしい。そんな時1人のお婆さんが声をかけてきた。「佐藤さんかい？」もちろん大魔王は佐藤さんではないので「大魔王だ」と答えた。「やっぱり佐藤さんよね？」とお婆さん。聞き間違えているし人違いである。「スマートフォンでお会計が出来ないのよ、佐藤さんいつもみたいに教えて」と言われ、一緒にコンビニへ入る。会計に行くと店員が「今日は佐藤さんと一緒なんですね。」と声をかけてきた。佐藤は誰なんだ。姿形も大魔王に似てる佐藤ってなんなんだ。と思いながらお婆さんのスマホを見ると自分にそっくりな人が待ち受けに写っている。俺はこの世で佐藤として生きているらしい
367640,6453057,なんとそこには人間は誰もおらず、すべてロボットが対応していました。「いらっしゃいませ」ロボットはそう声をかけてきました。大魔王が降り立った時代の渋谷ではすべてのコンビニがロボット化されていたのでした。大魔王は「これはいい」と思いました。なぜなら大魔王の住む地獄では、大魔王のあまりの厳しさに地獄の職員たちは根をあげてついていけずすぐに辞めてしまい人手不足に陥っていたからです。大魔王はすぐに地獄に帰り、ロボットを地獄に導入しました。こうして地獄ではロボット化が進み、人手不足は解消されたのでした。,6352436,従者は連れてきていないはず、なのに、ドアが開いたのだ。なぜ。いつのまに人間の文明が地獄の摂理を凌駕したのか。地獄に来た人間には、地獄インフラをつくるために24時間休みなしで働かせているのに、なぜやつらがこの扉を用意しないのだ。地獄現場監督の人間が150年前に死んだやつだからか？やはり、若者の登用が必要なのか？今度100年目のやつと入れ替えるか。ピコン。ん？なんだ？あ、ただの魔王からのメッセージ？は？メッセージ？なんだこの四角い板は！？「前に下界行ったときに買ったやつ。ポッケに入れといたよ。」ってなんだこれは！？書簡じゃなくても届くのか？おまえ、下界きたの20年前だろ！報告はどうなってんだよ！！,6713948,"「はて？どこから入るんだ？目の前の店の中には客がいるが、ドアが見つからない。」大魔王は不思議に思い、一歩店に近づく。すると突然、店の入口が開いたではないか。突然の出来事に再び呆気にとられる大魔王。それもそのはず。数百年前には自動ドアなど存在しなかったのだから。
気を取り直し店に入った大魔王は再び驚くことになる。周りの人間が誰一人自分を見て驚かないのだ。そこで大魔王は、どうしたら驚いてもらえるのか考え始めた。そして、手始めにたまたま目が合った店員に向って思いっ切り変顔をしてみた。店員はにこりと笑っただけだった。大魔王は驚きのあまり、固まってしまった。"
